ProductName,Review
Apple iPhone 13 Pro Max,"This is a great product. It has a beautiful display and powerful performance."
Samsung Galaxy S21 Ultra,"Buena calidad. Este producto tiene una alta calidad y rendimiento."
OnePlus 9R,"Joli design. Ce produit a un joli design et une bonne performance."
Xiaomi Mi 11 Ultra,"Fácil de usar. Este producto es fácil de usar y tiene un buen rendimiento."
Google Pixel 6 Pro,"Altamente recomendado. Este producto es altamente recomendado y tiene un gran rendimiento."
LG G8X ThinQ,"Valor por el dinero. Este producto ofrece mucho valor por el dinero y tiene un buen rendimiento."
Motorola Edge XT,"Excellent service. Este producto ofrece un excelente servicio y tiene un buen rendimiento."
